{
  "schema": "WorldRuntimeEntry/v1",
  "selector": "kawo-prototype-v1",
  "world": {
    "id": "kawo.prototype",
    "version": "0.1.0-prototype",
    "sha256": "939b1436943a9677407ad0edb03fb5a638bce2880d9f98d7b1452b7222c4269c",
    "bytes": 6404
  },
  "files": [
    {
      "path": "ground.fgrd",
      "sha256": "b2c53308fdc427900d84b541aff51ba66cbb71bc483fcee0ea16d067dbd15cfb",
      "bytes": 25973686,
      "role": "resident-ground-grid-v1"
    },
    {
      "path": "airport.json",
      "sha256": "63463d30c55f8aba56a3426efd7c2dd61287a99d66d307f3940b589b97fd6c18",
      "bytes": 37101,
      "role": "airport-source-record"
    },
    {
      "path": "dossier.json",
      "sha256": "974345fd8eedff2e339e4eb21b8ac3a09ed69c66c4d2a045b430f9655bd15cee",
      "bytes": 15785,
      "role": "airport-source-dossier"
    },
    {
      "path": "compile-receipt.json",
      "sha256": "cb1e0b28384aeb1c11173d991b5790a8a16e64953c2c479be6b07136c5f489f0",
      "bytes": 22937,
      "role": "terrain-compile-receipt-v1"
    },
    {
      "path": "start-ready34.json",
      "sha256": "05cb113c22168c15c27065732c2b10273de5f24400cff47cbcda973e208d6d0f",
      "bytes": 848,
      "role": "world-start-recipe-v1"
    },
    {
      "path": "NOTICE.txt",
      "sha256": "8631077f739836d0c8e7c8000ae43412d48f2fd3205f3fdd19df4a46f71cce5e",
      "bytes": 2818,
      "role": "source-notice"
    }
  ],
  "world_anchor": {
    "ellipsoid_height_m": {
      "$binary64_le": "0000000000000000"
    },
    "latitude_rad": {
      "$binary64_le": "fdfc84c1e5e5ea3f"
    },
    "longitude_rad": {
      "$binary64_le": "5eedd3837e0e01c0"
    }
  },
  "model_identity": {
    "id": "original-interactive-prototype",
    "version": "0.1.0-prototype",
    "backend_model": "original-interactive"
  },
  "model_inventory_sha256": "98b30b5641ce86cc6f0af6298424606aa96a1e4a35ef3e9fcaf377bebb3f00cd",
  "named_start": "ground-ready",
  "wind_profile": "calm",
  "seed": "42",
  "clock": {
    "purpose": "runtime",
    "tick_rate_hz": 120
  },
  "angular_integration_method": null,
  "recording_version": 3
}
